"character_trait_levels_colour_text_att_trait_general_government_all_military_admin_1"	"Мечі та чоботи корисні, але накази рухають армії."	"true"
"character_trait_levels_colour_text_att_trait_general_government_all_military_admin_2"	"Залиште це мені… Ви отримаєте свої мечі."	"true"
"character_trait_levels_colour_text_att_trait_general_government_all_military_admin_3"	"Армії марширують на череві, але працюють на паперах."	"true"
"character_trait_levels_colour_text_att_trait_general_government_all_miner_1"	"Називайте мене як завгодно. Я насолоджуватимуся багатствами своїх шахт."	"true"
"character_trait_levels_colour_text_att_trait_general_government_all_miner_2"	"Під землею можна знайти безліч багатств."	"true"
"character_trait_levels_colour_text_att_trait_general_government_all_miner_3"	"Мати-Земля віддає свої багатства тим, хто достатньо мудрий, щоб їх знайти."	"true"
"character_trait_levels_colour_text_att_trait_general_government_all_pacifist_1"	"Війна: для чого вона потрібна\? Абсолютно ні для чого!"	"true"
"character_trait_levels_colour_text_att_trait_general_government_all_pacifist_2"	"Я не заберу чуже життя. Я б не зміг."	"true"
"character_trait_levels_colour_text_att_trait_general_government_all_pacifist_3"	"Це така марна трата життя, і для чого\?"	"true"
"character_trait_levels_colour_text_att_trait_general_government_all_trader_1"	"Торгівля, дурню, допомагає окупити все це!"	"true"
"character_trait_levels_colour_text_att_trait_general_government_all_trader_2"	"Ця людина знає ціну всьому і цінність нічого."	"true"
"character_trait_levels_colour_text_att_trait_general_government_all_trader_3"	"Ну ж бо! Торгуйтеся! Воно того не варте!"	"true"
"character_trait_levels_colour_text_att_trait_general_government_all_warmonger_1"	"Ми будемо битися з ними. До самих їхніх воріт."	"true"
"character_trait_levels_colour_text_att_trait_general_government_all_warmonger_2"	"Думаю, ви побачите, юначе, що війна насправді корисна майже для всього!"	"true"
"character_trait_levels_colour_text_att_trait_general_government_all_warmonger_3"	"Саме їхнє існування є загрозою для нашого власного. Ми повинні стерти їх усіх з лиця землі!"	"true"
"character_trait_levels_colour_text_att_trait_general_government_civilised_politician_1"	"Цей чоловік любить політиканство, і це робить його в цьому вправним."	"true"
"character_trait_levels_colour_text_att_trait_general_government_civilised_politician_2"	"Влада є природною для цієї людини, і він любить її використовувати."	"true"
"character_trait_levels_colour_text_att_trait_general_government_civilised_politician_3"	"Переконання та щирість – потужна зброя."	"true"
"character_trait_levels_colour_text_att_trait_general_military_all_disciplinarian_bad_1"	"Добрі слова не виграють битв."	"true"
"character_trait_levels_colour_text_att_trait_general_military_all_disciplinarian_bad_2"	"Легковажний характер вітається, поки мечі ворога заховані."	"true"
"character_trait_levels_colour_text_att_trait_general_military_all_disciplinarian_bad_3"	"Солдатам потрібна сталь, а не м’які слова."	"true"
"character_trait_levels_colour_text_att_trait_general_military_all_disciplinarian_good_1"	"Я чув, що єдине, чого треба боятися, це самого страху, що, звісно, ​​неправильно, як ви зараз дізнаєтесь!"	"true"
"character_trait_levels_colour_text_att_trait_general_military_all_disciplinarian_good_2"	"Підготуйте туалети до заходу сонця, хіба що ви хочете копати в темряві\?"	"true"
"character_trait_levels_colour_text_att_trait_general_military_all_disciplinarian_good_3"	"Я сказав «Стрибайте!» Ви, жалюгідні маленькі невдахи!"	"true"
"character_trait_levels_colour_text_att_trait_general_military_all_fighter_1"	"Цей чоловік може впоратися зі страхом в бою."	"true"
"character_trait_levels_colour_text_att_trait_general_military_all_fighter_2"	"Якщо доводиться битися, ви хочете, щоб цей хлопець був на вашому боці."	"true"
"character_trait_levels_colour_text_att_trait_general_military_all_fighter_3"	"Бойова майстерність цього чоловіка майже легендарна."	"true"
"character_trait_levels_colour_text_att_trait_general_military_all_high_casualties_1"	"Цей чоловік насолоджується видом крові, особливо ворожої крові."	"true"
"character_trait_levels_colour_text_att_trait_general_military_all_high_casualties_2"	"Цей чоловік насолоджується кровопролиттям заради себе самого."	"true"
"character_trait_levels_colour_text_att_trait_general_military_all_high_casualties_3"	"В’язні\? Паразити! Зайві голодні роти."	"true"
"character_trait_levels_colour_text_att_trait_general_military_all_looter_1"	"Переможцю – здобич."	"true"
"character_trait_levels_colour_text_att_trait_general_military_all_looter_2"	"Грабунок переможених – це занадто мало для цієї людини."	"true"
"character_trait_levels_colour_text_att_trait_general_military_all_looter_3"	"Що це за маленький геноцид між друзями\?"	"true"
"character_trait_levels_colour_text_att_trait_general_military_all_military_heritage_1"	"Під час походу зі своїм батьком цей чоловік виріс серед солдатів і знає їхні звички."	"true"
"character_trait_levels_colour_text_att_trait_general_military_all_noctophilia_1"	"Люди бояться в темряві. Але не цей чоловік."	"true"
"character_trait_levels_colour_text_att_trait_general_military_all_noctophilia_2"	"Ніч опускається і застає його самого, загубленого у снах у світі, повному тіней."	"true"
"character_trait_levels_colour_text_att_trait_general_military_all_noctophilia_3"	"Народжений опівночі, цей чоловік обурюється настанням світанку…"	"true"
"character_trait_levels_colour_text_att_trait_general_military_all_noctophobia_1"	"У темряві лунали дивні звуки. Цей чоловік пам'ятає їх усі."	"true"
"character_trait_levels_colour_text_att_trait_general_military_all_noctophobia_2"	"Темрява – не друг. Ніколи."	"true"
"character_trait_levels_colour_text_att_trait_general_military_all_noctophobia_3"	"Цей чоловік жахається темних, нескінченних годин ночі."	"true"
"character_trait_levels_colour_text_att_trait_general_military_all_strategist_1"	"Цей чоловік розуміє основну стратегію та знає, що йому потрібно більше вивчати."	"true"
"character_trait_levels_colour_text_att_trait_general_military_all_strategist_2"	"Цей чоловік є експертом зі стратегії та історії війни."	"true"
"character_trait_levels_colour_text_att_trait_general_military_all_strategist_3"	"Розуміння цієї людини у військових питаннях викликає заздрість у всіх."	"true"
"character_trait_levels_colour_text_att_trait_general_military_all_survivor_1"	"Те, що не вбиває, може справді змусити ваші очі сльозитися."	"true"
"character_trait_levels_colour_text_att_trait_general_military_all_survivor_2"	"Ця людина має відчуття небезпеки, що попереджає її, коли щось не так."	"true"
"character_trait_levels_colour_text_att_trait_general_military_all_survivor_3"	"Пращі та стріли шаленої долі зовсім минули цю людину."	"true"
"character_trait_levels_colour_text_att_trait_general_military_all_tactician_1"	"Ця людина читала про теорії командування на полі бою."	"true"
"character_trait_levels_colour_text_att_trait_general_military_all_tactician_2"	"Після тривалого вивчення класичних битв ця людина чудово розуміється на тактиці."	"true"
"character_trait_levels_colour_text_att_trait_general_military_all_tactician_3"	"Енциклопедичні знання тактичних праць дають цій людині перевагу."	"true"
"character_trait_levels_colour_text_att_trait_general_military_army_all_ambusher_bad_1"	"Незважаючи на всі його зусилля, засідки цієї людини ніколи не спрацьовують за планом."	"true"
"character_trait_levels_colour_text_att_trait_general_military_army_all_ambusher_bad_2"	"Цей чоловік міг би так само добре повісити табличку з написом "попереду засідка"."	"true"
"character_trait_levels_colour_text_att_trait_general_military_army_all_ambusher_bad_3"	"Цей чоловік не зміг би організувати сутички в храмі Вакха, не кажучи вже про раптовий напад."	"true"
"character_trait_levels_colour_text_att_trait_general_military_army_all_ambusher_good_1"	"Засідки цього чоловіка жорсткі та швидкі, і мало хто залишає в живих, щоб розповісти про це."	"true"
"character_trait_levels_colour_text_att_trait_general_military_army_all_ambusher_good_2"	"Перше і останнє, що знають жертви, що потрапили в засідку, це те, що вони мертві!"	"true"
"character_trait_levels_colour_text_att_trait_general_military_army_all_ambusher_good_3"	"Благородне мистецтво несподіванки втілено в цій людині."	"true"
"character_trait_levels_colour_text_att_trait_general_military_army_all_attacker_bad_1"	"Цій людині бракує впевненості під час атаки."	"true"
"character_trait_levels_colour_text_att_trait_general_military_army_all_attacker_bad_2"	"У цієї людини проблеми з організацією атаки."	"true"
"character_trait_levels_colour_text_att_trait_general_military_army_all_attacker_bad_3"	"Ця людина може перетворити перемогу на принизливу поразку!"	"true"
"character_trait_levels_colour_text_att_trait_general_military_army_all_attacker_good_1"	"Ця людина демонструє ознаки величі під час атаки."	"true"
"character_trait_levels_colour_text_att_trait_general_military_army_all_attacker_good_2"	"Чудове володіння тактикою надихає людей."	"true"
"character_trait_levels_colour_text_att_trait_general_military_army_all_attacker_good_3"	"Цей чоловік майже неперевершений в атаці."	"true"
"character_trait_levels_colour_text_att_trait_general_military_army_all_besieger_bad_1"	"Можливо, нам варто було спочатку спробувати таран\? Якісь думки\?"	"true"
"character_trait_levels_colour_text_att_trait_general_military_army_all_besieger_bad_2"	"О, на шляху велика стіна… Якісь ідеї\?"	"true"
"character_trait_levels_colour_text_att_trait_general_military_army_all_besieger_bad_3"	"…Але вона 9 метрів заввишки! Як нам її подолати\?"	"true"
"character_trait_levels_colour_text_att_trait_general_military_army_all_besieger_good_1"	"Цей чоловік має око на слабкості та талант використовувати їх."	"true"
"character_trait_levels_colour_text_att_trait_general_military_army_all_besieger_good_2"	"Чудові навички під час штурму стін роблять цього чоловіка експертом."	"true"
"character_trait_levels_colour_text_att_trait_general_military_army_all_besieger_good_3"	"Навички облоги цього чоловіка майже легендарні."	"true"
"character_trait_levels_colour_text_att_trait_general_military_army_all_defender_bad_1"	"Цьому чоловікові бракує впевненості в обороні."	"true"
"character_trait_levels_colour_text_att_trait_general_military_army_all_defender_bad_2"	"Захист не є частиною військового мистецтва цього чоловіка."	"true"
"character_trait_levels_colour_text_att_trait_general_military_army_all_defender_bad_3"	"Цей чоловік не має помітного таланту до оборони."	"true"
"character_trait_levels_colour_text_att_trait_general_military_army_all_defender_good_1"	"В обороні цей чоловік має ясну голову та сильну руку."	"true"
"character_trait_levels_colour_text_att_trait_general_military_army_all_defender_good_2"	"Досвід оборони цього чоловіка вселяє його людям впевненість."	"true"
"character_trait_levels_colour_text_att_trait_general_military_army_all_defender_good_3"	"Вища оборонна майстерність цього чоловіка часто перемагає нападників."	"true"
"character_trait_levels_colour_text_att_trait_general_military_army_all_siege_defender_bad_1"	"Цей чоловік втратив не одне місто, але, на жаль, врятувався."	"true"
"character_trait_levels_colour_text_att_trait_general_military_army_all_siege_defender_bad_2"	"Його оборонні навички легендарні, але не в хорошому сенсі."	"true"
"character_trait_levels_colour_text_att_trait_general_military_army_all_siege_defender_bad_3"	"Горе будь-якому місту, залишеному під опікою цього чоловіка!"	"true"
"character_trait_levels_colour_text_att_trait_general_military_army_all_siege_defender_good_1"	"Цей чоловік може захистити поселення. Сам, якщо потрібно."	"true"
"character_trait_levels_colour_text_att_trait_general_military_army_all_siege_defender_good_2"	"Оборонні навички цього чоловіка гідні епічної поеми."	"true"
"character_trait_levels_colour_text_att_trait_general_military_army_all_siege_defender_good_3"	"Дайте цьому чоловікові стіну, і він захистить її навіть проти богів!"	"true"
"character_trait_levels_colour_text_att_trait_general_military_barbarian_berserker_1"	"Гррррррр! Червоний туман іде! Дайте мені їх!"	"true"
"character_trait_levels_colour_text_att_trait_general_military_barbarian_berserker_2"	"Жорстока лють цього чоловіка — це щось, що варто побачити."	"true"
"character_trait_levels_colour_text_att_trait_general_military_barbarian_berserker_3"	"Цей чоловік: якщо побачите його, біжіть. Просто біжіть. Швидко!"	"true"
"character_trait_levels_colour_text_att_trait_general_military_navy_all_attacker_sea_bad_1"	"Цей чоловік не впевнений на воді. І в битві."	"true"
"character_trait_levels_colour_text_att_trait_general_military_navy_all_attacker_sea_bad_2"	"Навіть мати цього чоловіка кращий флотоводець."	"true"
"character_trait_levels_colour_text_att_trait_general_military_navy_all_attacker_sea_bad_3"	"Командування на морі дало цьому чоловікові блискучий шолом. Але нічого більше."	"true"
"character_trait_levels_colour_text_att_trait_general_military_navy_all_attacker_sea_good_1"	"Цей чоловік точно розвиває свої навички флотоводця."	"true"
"character_trait_levels_colour_text_att_trait_general_military_navy_all_attacker_sea_good_2"	"Цей чоловік має чудове розуміння морської тактики."	"true"
"character_trait_levels_colour_text_att_trait_general_military_navy_all_attacker_sea_good_3"	"Командування на морі зробило цього чоловіка легендою."	"true"
"character_trait_levels_colour_text_att_trait_general_military_navy_all_blockade_defender_bad_1"	"Зачекайте, поки ви побачите їхні білі… О, чорт, вони на нас — приготуйтеся!"	"true"
"character_trait_levels_colour_text_att_trait_general_military_navy_all_blockade_defender_bad_2"	"Що ви маєте на увазі, ми не повинні дозволити їм висадитися, перш ніж атакувати\?"	"true"
"character_trait_levels_colour_text_att_trait_general_military_navy_all_blockade_defender_bad_3"	"Я не піду туди, бо можу померти!"	"true"
"character_trait_levels_colour_text_att_trait_general_military_navy_all_blockade_defender_good_1"	"Це лише кілька кораблів, і жоден з них не такий швидкий, як наші. Повірте мені."	"true"
"character_trait_levels_colour_text_att_trait_general_military_navy_all_blockade_defender_good_2"	"Вони не ступлять на той пляж, нам усім доведеться померти, перш ніж я це дозволю!"	"true"
"character_trait_levels_colour_text_att_trait_general_military_navy_all_blockade_defender_good_3"	"Хто б не став на шляху цієї людини, буде годувати риб."	"true"
"character_trait_levels_colour_text_att_trait_general_military_navy_all_blockader_bad_1"	"Цей чоловік не раз провалював блокаду ворожих портів."	"true"
"character_trait_levels_colour_text_att_trait_general_military_navy_all_blockader_bad_2"	"Ох, якби тільки ми були ближче один до одного. Неважливо."	"true"
"character_trait_levels_colour_text_att_trait_general_military_navy_all_blockader_bad_3"	"Він жодного разу не провів успішної блокади."	"true"
"character_trait_levels_colour_text_att_trait_general_military_navy_all_blockader_good_1"	"Я хочу, щоб ви засипали стрілами кожного, хто спробує прорватися через цю лінію, зрозуміло\?"	"true"
"character_trait_levels_colour_text_att_trait_general_military_navy_all_blockader_good_2"	"Цей чоловік — досвідчений капітан мореплавства та майстер морської блокади."	"true"
"character_trait_levels_colour_text_att_trait_general_military_navy_all_blockader_good_3"	"Що б не було в порту, воно точно не вийде звідти."	"true"
"character_trait_levels_colour_text_att_trait_general_military_navy_all_defender_sea_bad_1"	"Цей чоловік викинув за борт книгу морської тактики. Дурень."	"true"
"character_trait_levels_colour_text_att_trait_general_military_navy_all_defender_sea_bad_2"	"Цей чоловік не зміг би захистити честь своєї матері, не кажучи вже про флот."	"true"
"character_trait_levels_colour_text_att_trait_general_military_navy_all_defender_sea_bad_3"	"Послід чайки має кращу оборонну здатність."	"true"
"character_trait_levels_colour_text_att_trait_general_military_navy_all_defender_sea_good_1"	"Цей чоловік розуміє оборону на морі."	"true"
"character_trait_levels_colour_text_att_trait_general_military_navy_all_defender_sea_good_2"	"Цей чоловік зазвичай перемагає, захищаючись на морі."	"true"
"character_trait_levels_colour_text_att_trait_general_military_navy_all_defender_sea_good_3"	"Морські боги благословили цього чоловіка тактичною кмітливістю."	"true"
"character_trait_levels_colour_text_att_trait_general_military_navy_all_escort_bad_1"	"Так, вибачте за це, весла застрягли на рифі, а потім щогла обвалилася."	"true"
"character_trait_levels_colour_text_att_trait_general_military_navy_all_escort_bad_2"	"Цей чоловік ледве може захистити власний корабель, не кажучи вже про інші."	"true"
"character_trait_levels_colour_text_att_trait_general_military_navy_all_escort_bad_3"	"Ми були в конвої\? Справді\? Що\? Ті інші кораблі\?"	"true"
"character_trait_levels_colour_text_att_trait_general_military_navy_all_escort_good_1"	"Цей чоловік не раз скеровував торгові та військові флоти в безпеку."	"true"
"character_trait_levels_colour_text_att_trait_general_military_navy_all_escort_good_2"	"Якщо ви хочете забезпечити безпеку вашого конвою, доручіть цьому хлопцеві командувати."	"true"
"character_trait_levels_colour_text_att_trait_general_military_navy_all_escort_good_3"	"Я ще ніколи не втрачав жодного вантажу! Жодного!"	"true"
"character_trait_levels_colour_text_att_trait_general_personality_all_arse_1"	"Є плотські втіхи, якими не всі насолоджуються."	"true"
"character_trait_levels_colour_text_att_trait_general_personality_all_arse_2"	"Це робить мене щасливим."	"true"
"character_trait_levels_colour_text_att_trait_general_personality_all_arse_3"	"«Хто» чи «що» не має значення. Зазвичай має значення «як»."	"true"
"character_trait_levels_colour_text_att_trait_general_personality_all_bereaved_1"	"Смуток панував у серці цієї людини з тих пір, як він втратив усе, що йому було дорого."	"true"
"character_trait_levels_colour_text_att_trait_general_personality_all_bereaved_2"	"Його серце розбите. Безповоротно."	"true"
"character_trait_levels_colour_text_att_trait_general_personality_all_bereaved_3"	"Ця людина втратила все, що було їй дорого."	"true"
"character_trait_levels_colour_text_att_trait_general_personality_all_bravery_1"	"Битва — це старий друг, такий же бажаний, як добре вино."	"true"
"character_trait_levels_colour_text_att_trait_general_personality_all_bravery_2"	"Мужність цієї людини надихає на багато великих подвигів."	"true"
"character_trait_levels_colour_text_att_trait_general_personality_all_bravery_3"	"Безстрашний воїн, його люди завжди йдуть за ним, незважаючи на ризик."	"true"
"character_trait_levels_colour_text_att_trait_general_personality_all_cowardice_1"	"Цей чоловік тікає з битви, навіть якщо немає необхідності. Або губиться."	"true"
"character_trait_levels_colour_text_att_trait_general_personality_all_cowardice_2"	"Страх заважає цьому чоловікові в битві. Страх самої битви."	"true"
"character_trait_levels_colour_text_att_trait_general_personality_all_cowardice_3"	"Боязкість цього чоловіка в бою добре відома, він великий боягуз."	"true"
"character_trait_levels_colour_text_att_trait_general_personality_all_dishonest_1"	"Цьому чоловікові не можна довіряти будь що. Зовсім."	"true"
"character_trait_levels_colour_text_att_trait_general_personality_all_dishonest_2"	"Речі такі, які є. Вода мокра. Ця людина не надійна."	"true"
"character_trait_levels_colour_text_att_trait_general_personality_all_dishonest_3"	"Цей чоловік настільки мерзенно брехливий, наскільки це можливо."	"true"
"character_trait_levels_colour_text_att_trait_general_personality_all_feck_1"	"Міцні прокльони роблять цю людину «героєм». І грубим."	"true"
