"character_trait_levels_colour_text_att_trait_agent_personality_all_innate_sneaky_1"	"У цієї людини зміїний розум, не обтяжений ввічливими умовностями."	"true"
"character_trait_levels_colour_text_att_trait_agent_personality_all_innate_stupid_1"	"Вибач, старий друже, боюся, що між вухами у мене не так багато думок!"	"true"
"character_trait_levels_colour_text_att_trait_agent_personality_all_mad_1"	"Хіба це важливо\? Бззз! Бзззз! Я сьогодні замало меду нажив! Бзззз!"	"true"
"character_trait_levels_colour_text_att_trait_agent_personality_all_mad_2"	"Мені подобаються твої очі. У тебе гарні очі. Дуже гарні очі. Так."	"true"
"character_trait_levels_colour_text_att_trait_agent_personality_all_mad_3"	"Я маленький горщик, низький і кремезний…"	"true"
"character_trait_levels_colour_text_att_trait_agent_physical_all_innate_clumsy_1"	"Дві ліві руки краще, ніж жодної."	"true"
"character_trait_levels_colour_text_att_trait_agent_physical_all_innate_inbred_1"	"Деяким людям бракує традиційної кількості бабусь і дідусів."	"true"
"character_trait_levels_colour_text_att_trait_agent_physical_all_innate_very_inbred_1"	"Коли близькі родичі стають батьками, наслідки можуть бути невтішними."	"true"
"character_trait_levels_colour_text_att_trait_agent_physical_all_innate_very_very_inbred_1"	"Збереження чистоти роду не завжди гарна ідея."	"true"
"character_trait_levels_colour_text_att_trait_agent_status_all_slave_1"	"Я розумію рабський розум і його інтриги…"	"true"
"character_trait_levels_colour_text_att_trait_agent_status_not_roman_poor_1"	"Пастух може досягти величі, якщо так написано."	"true"
"character_trait_levels_colour_text_att_trait_agent_status_not_roman_wealthy_1"	"Багатство – це сила, і ця людина має надлишок сили."	"true"
"character_trait_levels_colour_text_att_trait_agent_status_roman_poor_1"	"Людина простого походження, але за своєю суттю гідна, може по праву досягти визнання у світі."	"true"
"character_trait_levels_colour_text_att_trait_agent_status_roman_wealthy_1"	"А що, якщо я маю міцні кровні та шлюбні зв'язки\?"	"true"
"character_trait_levels_colour_text_att_trait_all_personality_all_atheist_1"	"Щоразу, коли я молюся, я дивуюся, чому я цим переймаюся…"	"true"
"character_trait_levels_colour_text_att_trait_all_personality_all_atheist_2"	"Поклонінням\? Чому я маю це робити\?"	"true"
"character_trait_levels_colour_text_att_trait_all_personality_all_atheist_3"	"Чи виглядаю я настільки дурним, щоб вірити у великих, бородатих, розлючених людей на небі\?"	"true"
"character_trait_levels_colour_text_att_trait_all_personality_all_choleric_1"	"Цього чоловіка легко розлютити. І він пам'ятає своїх ворогів. О, так…"	"true"
"character_trait_levels_colour_text_att_trait_all_personality_all_drink_1"	"Трохи вина нікому не зашкодить."	"true"
"character_trait_levels_colour_text_att_trait_all_personality_all_drink_2"	"Смійтеся, і світ засміється, коли ви розливаєте своє вино."	"true"
"character_trait_levels_colour_text_att_trait_all_personality_all_drink_3"	"Пийте! Пийте! Чому ви не п'єте, покидьки\?"	"true"
"character_trait_levels_colour_text_att_trait_all_personality_all_easily_deceived_1"	"Цей чоловік від природи довірливий, чим інші користуються за кожної нагоди."	"true"
"character_trait_levels_colour_text_att_trait_all_personality_all_easily_distracted_1"	"О, дивіться, хмара схожа на Ганнібала! Ні, серйозно!"	"true"
"character_trait_levels_colour_text_att_trait_all_personality_all_easily_trapped_1"	"Цей чоловік не помітив би пастки, навіть якби та мала перед собою великий знак."	"true"
"character_trait_levels_colour_text_att_trait_all_personality_all_energetic_1"	"Відпочинок\? Відпочинок\? Я ж не слабак!"	"true"
"character_trait_levels_colour_text_att_trait_all_personality_all_energetic_2"	"Сьогодні багато справ! Чудово!"	"true"
"character_trait_levels_colour_text_att_trait_all_personality_all_energetic_3"	"Я засну, коли помру!"	"true"
"character_trait_levels_colour_text_att_trait_all_personality_all_innate_boring_1"	"Краще відгризти собі ногу, ніж терпіти товариство цього чоловіка."	"true"
"character_trait_levels_colour_text_att_trait_all_personality_all_innate_charismatic_1"	"У деяких чоловіків є природний владний вид."	"true"
"character_trait_levels_colour_text_att_trait_all_personality_all_innate_intelligent_1"	"Дотепність може завести людину далі, ніж сильні ноги."	"true"
"character_trait_levels_colour_text_att_trait_all_personality_all_innate_irresolute_1"	"Так. Ні. Можливо. Я не знаю!"	"true"
"character_trait_levels_colour_text_att_trait_all_personality_all_innate_uncompromising_1"	"Я не приймаю відмови."	"true"
"character_trait_levels_colour_text_att_trait_all_personality_all_lazy_1"	"Навіщо робити сьогодні те, що можна відкласти до наступного тижня\?"	"true"
"character_trait_levels_colour_text_att_trait_all_personality_all_lazy_2"	"Чому я повинен\? Ці раби стоять склавши руки."	"true"
"character_trait_levels_colour_text_att_trait_all_personality_all_lazy_3"	"Якби він міг знайти когось іншого, хто б випорожнив його кишечник, він би це зробив."	"true"
"character_trait_levels_colour_text_att_trait_all_personality_all_lewd_1"	"Нескінченні одкровення збоченості, реальні та уявні, зрештою стають нудними."	"true"
"character_trait_levels_colour_text_att_trait_all_personality_all_lewd_2"	"Навіть боги похоті відвернулися від цього мерзенного чоловіка."	"true"
"character_trait_levels_colour_text_att_trait_all_personality_all_lewd_3"	"Навіть найкоротша зустріч з цим мерзенним збоченцем змушує більшість людей бігти до лазні, щоб очиститися."	"true"
"character_trait_levels_colour_text_att_trait_all_personality_all_lucky_1"	"Деяким людям просто щастить."	"true"
"character_trait_levels_colour_text_att_trait_all_personality_all_lucky_2"	"Дехто назвав би це везінням, я називаю це вмінням."	"true"
"character_trait_levels_colour_text_att_trait_all_personality_all_lucky_3"	"Духи пильнують мене."	"true"
"character_trait_levels_colour_text_att_trait_all_personality_all_melancholic_1"	"Посмішка, навіть на чужі нещастя, не є природною для цього старого кислого обличчя."	"true"
"character_trait_levels_colour_text_att_trait_all_personality_all_phlegmatic_1"	"Холодний і нехаризматичний, цьому чоловіку важко сподобатися."	"true"
"character_trait_levels_colour_text_att_trait_all_personality_all_sanguine_1"	"Байдужий вираз приховує багато думок."	"true"
"character_trait_levels_colour_text_att_trait_all_personality_all_sober_1"	"Вино може бути приємним, але цей чоловік ніколи цього не дізнається."	"true"
"character_trait_levels_colour_text_att_trait_all_personality_all_sober_2"	"Тверезий погляд на все — ось шлях цього чоловіка в житті."	"true"
"character_trait_levels_colour_text_att_trait_all_personality_all_sober_3"	"Під моїм дахом не місце розпусті, хтивості та п'яницям, що плавають у власній блювоті!"	"true"
"character_trait_levels_colour_text_att_trait_all_personality_all_unlucky_1"	"Не в тому місці, не в той час. Що ви збираєтеся робити\?"	"true"
"character_trait_levels_colour_text_att_trait_all_personality_all_unlucky_2"	"Що ж. Мабуть, варто було спробувати."	"true"
"character_trait_levels_colour_text_att_trait_all_personality_all_unlucky_3"	"Є «невдахи» та є «прокляті згори». Відчуйте різницю."	"true"
"character_trait_levels_colour_text_att_trait_all_physical_all_healthy_1"	"Сильний хлопець, міцний, як віл!"	"true"
"character_trait_levels_colour_text_att_trait_all_physical_all_healthy_2"	"Хвороба — це те, що трапляється з іншими людьми."	"true"
"character_trait_levels_colour_text_att_trait_all_physical_all_healthy_3"	"Цей чоловік благословенний статурою бога!"	"true"
"character_trait_levels_colour_text_att_trait_all_physical_all_unhealthy_1"	"Дитяча хвороба кидає свою тінь на цього чоловіка."	"true"
"character_trait_levels_colour_text_att_trait_all_physical_all_unhealthy_2"	"Як казала мати, варто дбати про своє здоров'я…"	"true"
"character_trait_levels_colour_text_att_trait_all_physical_all_unhealthy_3"	"Навіть підняття меча виснажує цього бідолаху."	"true"
"character_trait_levels_colour_text_att_trait_anastasius_marker_1"	"Анастасій"	"true"
"character_trait_levels_colour_text_att_trait_antonina_marker_1"	"Антоніна"	"true"
"character_trait_levels_colour_text_att_trait_belisarius_marker_1"	"Велісарій"	"true"
"character_trait_levels_colour_text_att_trait_champion_actions_all_arson_1"	"Як змусити раба «вовкнути»\?"	"true"
"character_trait_levels_colour_text_att_trait_champion_actions_all_arson_2"	"Нагальні проблеми потребують вирішення."	"true"
"character_trait_levels_colour_text_att_trait_champion_actions_all_arson_3"	"Полум'я — це гарно."	"true"
"character_trait_levels_colour_text_att_trait_champion_actions_all_callous_1"	"Тяжке становище інших мало цікавить цю людину."	"true"
"character_trait_levels_colour_text_att_trait_champion_actions_all_callous_2"	"Деякі люди просто холоднокровні."	"true"
"character_trait_levels_colour_text_att_trait_champion_actions_all_callous_3"	"Хтось, хай замовкне ця нявкаюча дитина…"	"true"
"character_trait_levels_colour_text_att_trait_champion_actions_all_cruel_1"	"Іноді репутації жорстокого достатньо."	"true"
"character_trait_levels_colour_text_att_trait_champion_actions_all_cruel_2"	"Не бійся, я не завдам тобі сильної шкоди."	"true"
"character_trait_levels_colour_text_att_trait_champion_actions_all_cruel_3"	"Достатньо підняти брову, щоб йому розпороли живіт."	"true"
"character_trait_levels_colour_text_att_trait_champion_actions_all_guerrilla_activity_1"	"Я борюся там, де ворог не може."	"true"
"character_trait_levels_colour_text_att_trait_champion_actions_all_guerrilla_activity_2"	"Я борюся не з силою свого ворога, а лише з його слабкістю."	"true"
"character_trait_levels_colour_text_att_trait_champion_actions_all_guerrilla_activity_3"	"Темрява приховує армію ножів."	"true"
"character_trait_levels_colour_text_att_trait_champion_actions_all_instructor_1"	"Наполегливі тренування означають легші битви."	"true"
"character_trait_levels_colour_text_att_trait_champion_actions_all_instructor_2"	"Муштра – це поклоніння! Поклоніння богам війни!"	"true"
"character_trait_levels_colour_text_att_trait_champion_actions_all_instructor_3"	"Чоловіки ненавидять його, але роблять те, що їм кажуть."	"true"
"character_trait_levels_colour_text_att_trait_champion_actions_all_violent_1"	"Який сенс чистити його\?"	"true"
"character_trait_levels_colour_text_att_trait_champion_actions_all_violent_2"	"Деякі воїни просто не знають, коли зупинитися."	"true"
"character_trait_levels_colour_text_att_trait_champion_actions_all_violent_3"	"Заради богів! Він уже справді мертвий!"	"true"
"character_trait_levels_colour_text_att_trait_eos_dam_repair_1"	"За неохочими спинами батіг плаче."	"true"
"character_trait_levels_colour_text_att_trait_eos_queen_mavia_1"	"[Unseen]"	"true"
"character_trait_levels_colour_text_att_trait_general_ability_all_brace_1"	"Приготуйтеся, хлопці, вони йдуть!"	"true"
"character_trait_levels_colour_text_att_trait_general_ability_all_brace_2"	"Приготуйтеся, хлопці, вони йдуть!"	"true"
"character_trait_levels_colour_text_att_trait_general_ability_all_brace_3"	"Приготуйтеся, хлопці, вони йдуть!"	"true"
"character_trait_levels_colour_text_att_trait_general_ability_all_brace_4"	"Приготуйтеся, хлопці, вони йдуть!"	"true"
"character_trait_levels_colour_text_att_trait_general_ability_all_brace_5"	"Приготуйтеся, хлопці, вони йдуть!"	"true"
"character_trait_levels_colour_text_att_trait_general_ability_all_fast_1"	"Хто хоче жити вічно\? В атаку!!!"	"true"
"character_trait_levels_colour_text_att_trait_general_ability_all_fast_2"	"Хто хоче жити вічно\? В атаку!!!"	"true"
"character_trait_levels_colour_text_att_trait_general_ability_all_fast_3"	"Хто хоче жити вічно\? В атаку!!!"	"true"
"character_trait_levels_colour_text_att_trait_general_ability_all_fast_4"	"Хто хоче жити вічно\? В атаку!!!"	"true"
"character_trait_levels_colour_text_att_trait_general_ability_all_fast_5"	"Хто хоче жити вічно\? В атаку!!!"	"true"
"character_trait_levels_colour_text_att_trait_general_ability_all_fear_1"	"Ні. Ти цього не переживеш."	"true"
"character_trait_levels_colour_text_att_trait_general_ability_all_fear_2"	"Ні. Ти цього не переживеш."	"true"
"character_trait_levels_colour_text_att_trait_general_ability_all_fear_3"	"Ні. Ти цього не переживеш."	"true"
"character_trait_levels_colour_text_att_trait_general_ability_all_fear_4"	"Ні. Ти цього не переживеш."	"true"
"character_trait_levels_colour_text_att_trait_general_ability_all_fear_5"	"Ні. Ти цього не переживеш."	"true"
"character_trait_levels_colour_text_att_trait_general_ability_all_inspire_1"	"У бою ця людина надихає своїх воїнів на вчинки неймовірного героїзму."	"true"
"character_trait_levels_colour_text_att_trait_general_ability_all_inspire_2"	"У бою ця людина надихає своїх воїнів на вчинки неймовірного героїзму."	"true"
"character_trait_levels_colour_text_att_trait_general_ability_all_inspire_3"	"У бою ця людина надихає своїх воїнів на вчинки неймовірного героїзму."	"true"
"character_trait_levels_colour_text_att_trait_general_ability_all_inspire_4"	"У бою ця людина надихає своїх воїнів на вчинки неймовірного героїзму."	"true"
"character_trait_levels_colour_text_att_trait_general_ability_all_inspire_5"	"У бою ця людина надихає своїх воїнів на вчинки неймовірного героїзму."	"true"
"character_trait_levels_colour_text_att_trait_general_ability_all_power_1"	"Гніть свої спини, чоловіки, бо я їх зламаю!"	"true"
"character_trait_levels_colour_text_att_trait_general_ability_all_power_2"	"Гніть свої спини, чоловіки, бо я їх зламаю!"	"true"
"character_trait_levels_colour_text_att_trait_general_ability_all_power_3"	"Гніть свої спини, чоловіки, бо я їх зламаю!"	"true"
"character_trait_levels_colour_text_att_trait_general_ability_all_power_4"	"Гніть свої спини, чоловіки, бо я їх зламаю!"	"true"
"character_trait_levels_colour_text_att_trait_general_ability_all_power_5"	"Гніть свої спини, чоловіки, бо я їх зламаю!"	"true"
"character_trait_levels_colour_text_att_trait_general_ability_all_presence_1"	"Грізний воєначальник, якого поважали навіть вороги."	"true"
"character_trait_levels_colour_text_att_trait_general_ability_all_presence_2"	"Грізний воєначальник, якого поважали навіть вороги."	"true"
"character_trait_levels_colour_text_att_trait_general_ability_all_presence_3"	"Грізний воєначальник, якого поважали навіть вороги."	"true"
"character_trait_levels_colour_text_att_trait_general_ability_all_presence_4"	"Грізний воєначальник, якого поважали навіть вороги."	"true"
"character_trait_levels_colour_text_att_trait_general_ability_all_presence_5"	"Грізний воєначальник, якого поважали навіть вороги."	"true"
"character_trait_levels_colour_text_att_trait_general_ability_all_raise_1"	"Справжній герой ніколи не уникає битви."	"true"
"character_trait_levels_colour_text_att_trait_general_ability_all_raise_2"	"Справжній герой ніколи не уникає битви."	"true"
"character_trait_levels_colour_text_att_trait_general_ability_all_raise_3"	"Справжній герой ніколи не уникає битви."	"true"
"character_trait_levels_colour_text_att_trait_general_ability_all_raise_4"	"Справжній герой ніколи не уникає битви."	"true"
"character_trait_levels_colour_text_att_trait_general_ability_all_raise_5"	"Справжній герой ніколи не уникає битви."	"true"
"character_trait_levels_colour_text_att_trait_general_ability_all_rally_1"	"Окрім хоробрості, ця людина вселяє мужність у своїх послідовників."	"true"
"character_trait_levels_colour_text_att_trait_general_ability_all_rally_2"	"Окрім хоробрості, ця людина вселяє мужність у своїх послідовників."	"true"
"character_trait_levels_colour_text_att_trait_general_ability_all_rally_3"	"Окрім хоробрості, ця людина вселяє мужність у своїх послідовників."	"true"
"character_trait_levels_colour_text_att_trait_general_ability_all_rally_4"	"Окрім хоробрості, ця людина вселяє мужність у своїх послідовників."	"true"
"character_trait_levels_colour_text_att_trait_general_ability_all_rally_5"	"Окрім хоробрості, ця людина вселяє мужність у своїх послідовників."	"true"
"character_trait_levels_colour_text_att_trait_general_ability_all_recon_1"	"Я просто знаю, де ворог."	"true"
"character_trait_levels_colour_text_att_trait_general_ability_all_recon_2"	"Я просто знаю, де ворог."	"true"
"character_trait_levels_colour_text_att_trait_general_ability_all_recon_3"	"Я просто знаю, де ворог."	"true"
"character_trait_levels_colour_text_att_trait_general_ability_all_recon_4"	"Я просто знаю, де ворог."	"true"
"character_trait_levels_colour_text_att_trait_general_ability_all_recon_5"	"Я просто знаю, де ворог."	"true"
"character_trait_levels_colour_text_att_trait_general_ability_all_second_1"	"Це\? Це ж просто царапина! Хто наступний\?!"	"true"
"character_trait_levels_colour_text_att_trait_general_ability_all_second_2"	"Це\? Це ж просто царапина! Хто наступний\?!"	"true"
"character_trait_levels_colour_text_att_trait_general_ability_all_second_3"	"Це\? Це ж просто царапина! Хто наступний\?!"	"true"
"character_trait_levels_colour_text_att_trait_general_ability_all_second_4"	"Це\? Це ж просто царапина! Хто наступний\?!"	"true"
"character_trait_levels_colour_text_att_trait_general_ability_all_second_5"	"Це\? Це ж просто царапина! Хто наступний\?!"	"true"
"character_trait_levels_colour_text_att_trait_general_ability_all_war_1"	"Його жага до битви невгамовна, незалежно від ціни в життях."	"true"
"character_trait_levels_colour_text_att_trait_general_ability_all_war_2"	"Його жага до битви невгамовна, незалежно від ціни в життях."	"true"
"character_trait_levels_colour_text_att_trait_general_ability_all_war_3"	"Його жага до битви невгамовна, незалежно від ціни в життях."	"true"
"character_trait_levels_colour_text_att_trait_general_ability_all_war_4"	"Його жага до битви невгамовна, незалежно від ціни в життях."	"true"
"character_trait_levels_colour_text_att_trait_general_ability_all_war_5"	"Його жага до битви невгамовна, незалежно від ціни в життях."	"true"
"character_trait_levels_colour_text_att_trait_general_government_all_admin_bad_1"	"Час випити\? Ми можемо все це вирішити протягом тижня…"	"true"
"character_trait_levels_colour_text_att_trait_general_government_all_admin_bad_2"	"Ні, не знаю, куди воно поділося. Неважливо…"	"true"
"character_trait_levels_colour_text_att_trait_general_government_all_admin_bad_3"	"Цей чоловік надто зарозумілий, щоб визнати, що він не правий."	"true"
"character_trait_levels_colour_text_att_trait_general_government_all_admin_good_1"	"Цей чоловік може використати зусилля багатьох для досягнення майже будь-якої мети."	"true"
"character_trait_levels_colour_text_att_trait_general_government_all_admin_good_2"	"Гарне управління — як свіже повітря. Його відсутність легко помітити."	"true"
"character_trait_levels_colour_text_att_trait_general_government_all_admin_good_3"	"Цей чоловік настільки ефективний, що люди дивуються, що він робить цілий день."	"true"
"character_trait_levels_colour_text_att_trait_general_government_all_architect_1"	"Великі будівлі, що здіймаються вгору, дещо говорять про свого творця."	"true"
"character_trait_levels_colour_text_att_trait_general_government_all_architect_2"	"Мене пам'ятатимуть як будівельника, а не як убивцю!"	"true"
"character_trait_levels_colour_text_att_trait_general_government_all_architect_3"	"Моє бачення триватиме тисячу років!"	"true"
"character_trait_levels_colour_text_att_trait_general_government_all_authoritarian_1"	"Уряд — твердий, люблячий батько народу."	"true"
"character_trait_levels_colour_text_att_trait_general_government_all_authoritarian_2"	"Мої руки зв'язані. Правила є правила."	"true"
"character_trait_levels_colour_text_att_trait_general_government_all_authoritarian_3"	"Милосердний уряд — це оксюморон."	"true"
"character_trait_levels_colour_text_att_trait_general_government_all_farmer_1"	"Ситий живіт не любить пояса з мечем."	"true"
"character_trait_levels_colour_text_att_trait_general_government_all_farmer_2"	"Земля, що залишилася невикористаною, така ж корисна як і морське дно."	"true"
"character_trait_levels_colour_text_att_trait_general_government_all_farmer_3"	"Добре керована земля — основа багатства."	"true"
"character_trait_levels_colour_text_att_trait_general_government_all_government_heritage_1"	"Поки його батько керував провінціями, він стежив за кожним його кроком."	"true"
